{
  "apiVersion": "marshal.dev/v1alpha1",
  "kind": "SCMMergeIntent",
  "intentId": "intent-0a0a0a0a0a0a0a0a0a0a0a0a0a0a0a0a0a0a0a0a0a0a0a0a0a0a0a0a0a0a0a0a",
  "authorityNamespaceId": "authority:main",
  "taskId": "task-01",
  "runId": "run-01",
  "publicationRecordId": "sha256:bbbbbbbbbbbbbbbbbbbbbbbbbbbbbbbbbbbbbbbbbbbbbbbbbbbbbbbbbbbbbbbb",
  "publicationDigest": "sha256:bbbbbbbbbbbbbbbbbbbbbbbbbbbbbbbbbbbbbbbbbbbbbbbbbbbbbbbbbbbbbbbb",
  "reviewDecisionDigest": "sha256:dddddddddddddddddddddddddddddddddddddddddddddddddddddddddddddddd",
  "verificationDigest": "sha256:eeeeeeeeeeeeeeeeeeeeeeeeeeeeeeeeeeeeeeeeeeeeeeeeeeeeeeeeeeeeeeee",
  "evidenceDigest": "sha256:ffffffffffffffffffffffffffffffffffffffffffffffffffffffffffffffff",
  "policyDigest": "sha256:1111111111111111111111111111111111111111111111111111111111111111",
  "publishApprovalRecordId": "approval-01",
  "publishApprovalDigest": "sha256:2222222222222222222222222222222222222222222222222222222222222222",
  "remoteCheckRecordDigest": "sha256:3333333333333333333333333333333333333333333333333333333333333333",
  "repositoryRef": "example-org/example-repo",
  "prNumber": 7,
  "headOid": "0123456789abcdef0123456789abcdef01234567",
  "baseOid": "89abcdef0123456789abcdef0123456789abcdef",
  "mergeMethod": "squash",
  "requestedBy": "maintainer",
  "requestedAt": "2026-08-17T10:00:00Z",
  "expectedMergedBy": "github-login:maintainer",
  "mergerSecurityDomainId": "marshal:publication:scm-merger",
  "mergerCredentialIdentity": "sha256:4444444444444444444444444444444444444444444444444444444444444444",
  "intentDigest": "sha256:0cd8caff151ff25fae3049c51082cc0ed936b3db170abac1db6e33256971262b"
}
